{
  "schemaVersion": "trama.maturity-evidence-registry/v1",
  "updatedAt": "2026-10-17",
  "policy": {
    "projectionReadOnly": true,
    "automaticPromotion": false,
    "acceptedDecisionStatuses": [
      "APPROVED",
      "IMPLEMENTED"
    ]
  },
  "evidence": [
    {
      "id": "EV-MAT-GOV-DOC",
      "type": "DOCUMENT_CANONICAL",
      "area": "governance",
      "subject": "TRAMA ecosystem governance source registry",
      "status": "PASS",
      "source": {
        "ref": "source-registry:ecosystem-governance",
        "path": "docs/knowledge/source-registry.json"
      },
      "observedAt": "2026-09-25T00:00:00Z",
      "freshness": {
        "policy": "UNTIL_CHANGE"
      },
      "confidence": "HIGH",
      "supports": [
        {
          "level": 1
        }
      ]
    },
    {
      "id": "EV-MAT-GOV-CONTRACT-ADR001",
      "type": "CONTRACT_APPROVED",
      "area": "governance",
      "subject": "TRAMA governance authority contract",
      "status": "PASS",
      "source": {
        "ref": "TRAMA-ADR-001",
        "path": "docs/decisions/decision-register.json",
        "decisionRef": "TRAMA-ADR-001",
        "decisionStatus": "APPROVED"
      },
      "observedAt": "2026-09-21T00:00:00Z",
      "freshness": {
        "policy": "UNTIL_CHANGE"
      },
      "confidence": "HIGH",
      "supports": [
        {
          "level": 2
        }
      ]
    },
    {
      "id": "EV-MAT-GOV-CC3F1-HEAD",
      "type": "PR_EXACT_HEAD",
      "area": "governance",
      "subject": "CC3-F1 exact reviewed implementation head",
      "status": "PASS",
      "source": {
        "ref": "docs/reviews/CC3-F1-HUMAN-REVIEW-2026-09-26.md",
        "path": "docs/reviews/CC3-F1-HUMAN-REVIEW-2026-09-26.md"
      },
      "observedAt": "2026-09-26T00:00:00Z",
      "freshness": {
        "policy": "EVENT_BOUND"
      },
      "confidence": "HIGH",
      "supports": [
        {
          "level": 3
        }
      ],
      "binding": {
        "capabilityRef": "CC3-F1",
        "releaseRef": "TRAMA:CC3-F1",
        "exactHead": "686fe01b91b5e5b38a9956198e79c5ff713b0b8f"
      }
    },
    {
      "id": "EV-MAT-GOV-CC3F1-HUMAN",
      "type": "HUMAN_REVIEW",
      "area": "governance",
      "subject": "CC3-F1 human exact-head review",
      "status": "PASS",
      "source": {
        "ref": "docs/reviews/CC3-F1-HUMAN-REVIEW-2026-09-26.md",
        "path": "docs/reviews/CC3-F1-HUMAN-REVIEW-2026-09-26.md"
      },
      "observedAt": "2026-09-26T00:00:00Z",
      "freshness": {
        "policy": "EVENT_BOUND"
      },
      "confidence": "HIGH",
      "supports": [
        {
          "level": 4
        },
        {
          "gateRef": "GATE-CC3-F1-HUMAN"
        }
      ],
      "binding": {
        "capabilityRef": "CC3-F1",
        "releaseRef": "TRAMA:CC3-F1",
        "exactHead": "686fe01b91b5e5b38a9956198e79c5ff713b0b8f"
      }
    },
    {
      "id": "EV-MAT-ARENA-DOC",
      "type": "DOCUMENT_CANONICAL",
      "area": "arena",
      "subject": "Arena curriculum authority in source registry",
      "status": "PASS",
      "source": {
        "ref": "source-registry:curriculum",
        "path": "docs/knowledge/source-registry.json"
      },
      "observedAt": "2026-09-25T00:00:00Z",
      "freshness": {
        "policy": "UNTIL_CHANGE"
      },
      "confidence": "HIGH",
      "supports": [
        {
          "level": 1
        }
      ]
    },
    {
      "id": "EV-MAT-ARENA-CONTRACT-ADR002",
      "type": "CONTRACT_APPROVED",
      "area": "arena",
      "subject": "Arena authoritative curriculum decision",
      "status": "PASS",
      "source": {
        "ref": "TRAMA-ADR-002",
        "path": "docs/decisions/decision-register.json",
        "decisionRef": "TRAMA-ADR-002",
        "decisionStatus": "APPROVED"
      },
      "observedAt": "2026-09-21T00:00:00Z",
      "freshness": {
        "policy": "UNTIL_CHANGE"
      },
      "confidence": "HIGH",
      "supports": [
        {
          "level": 2
        }
      ]
    },
    {
      "id": "EV-MAT-ARENA-PR312-HEAD",
      "type": "PR_EXACT_HEAD",
      "area": "arena",
      "subject": "Arena ECO-01/S3 curriculum-source profile exact head",
      "status": "PASS",
      "source": {
        "ref": "github:CurManLight_arena/pull/312",
        "path": "docs/evidence/trama-maturity-evidence-binding-2026-09-29.md",
        "repository": "antoniocorsano-boop/CurManLight_arena",
        "prNumber": 312,
        "mergeCommit": "0d931c2c20a2c47c7a72c077faacf499feda6908"
      },
      "observedAt": "2026-09-20T13:13:36Z",
      "freshness": {
        "policy": "EVENT_BOUND"
      },
      "confidence": "HIGH",
      "supports": [
        {
          "level": 3
        }
      ],
      "binding": {
        "areaRef": "arena",
        "releaseRef": "CurManLight_arena#312",
        "exactHead": "65a7f5b820b344ec61f8e09d7559012aae521bbc"
      }
    },
    {
      "id": "EV-MAT-ARENA-PR312-CI",
      "type": "AUTOMATED_TEST",
      "area": "arena",
      "subject": "Arena Product CI for ECO-01/S3 curriculum-source profile",
      "status": "PASS",
      "source": {
        "ref": "github-actions:CurManLight_arena/run/35512448131",
        "path": "docs/evidence/trama-maturity-evidence-binding-2026-09-29.md",
        "repository": "antoniocorsano-boop/CurManLight_arena",
        "prNumber": 312,
        "runId": "35512448131"
      },
      "observedAt": "2026-09-20T13:06:15Z",
      "freshness": {
        "policy": "EVENT_BOUND"
      },
      "confidence": "HIGH",
      "supports": [
        {
          "level": 3
        },
        {
          "level": 4
        }
      ],
      "binding": {
        "areaRef": "arena",
        "releaseRef": "CurManLight_arena#312",
        "exactHead": "65a7f5b820b344ec61f8e09d7559012aae521bbc"
      }
    },
    {
      "id": "EV-MAT-ARENA-PR312-HUMAN",
      "type": "HUMAN_REVIEW",
      "area": "arena",
      "subject": "Arena ECO-01/S3 human cross-review",
      "status": "PASS",
      "source": {
        "ref": "github:CurManLight_arena/pull/312#issuecomment-5750603947",
        "path": "docs/evidence/trama-maturity-evidence-binding-2026-09-29.md",
        "repository": "antoniocorsano-boop/CurManLight_arena",
        "prNumber": 312,
        "commentId": "5750603947"
      },
      "observedAt": "2026-09-20T15:03:40Z",
      "freshness": {
        "policy": "EVENT_BOUND"
      },
      "confidence": "HIGH",
      "supports": [
        {
          "level": 4
        }
      ],
      "binding": {
        "areaRef": "arena",
        "releaseRef": "CurManLight_arena#312",
        "exactHead": "65a7f5b820b344ec61f8e09d7559012aae521bbc"
      }
    },
    {
      "id": "EV-MAT-ATLAS-DOC",
      "type": "DOCUMENT_CANONICAL",
      "area": "atlas",
      "subject": "Atlas resource/publication authority in source registry",
      "status": "PASS",
      "source": {
        "ref": "source-registry:learning-resources+atlas-publication",
        "path": "docs/knowledge/source-registry.json"
      },
      "observedAt": "2026-09-25T00:00:00Z",
      "freshness": {
        "policy": "UNTIL_CHANGE"
      },
      "confidence": "HIGH",
      "supports": [
        {
          "level": 1
        }
      ]
    },
    {
      "id": "EV-MAT-ATLAS-CONTRACT-ADR007",
      "type": "CONTRACT_APPROVED",
      "area": "atlas",
      "subject": "Atlas public and didactic surface governance decision",
      "status": "PASS",
      "source": {
        "ref": "TRAMA-ADR-007",
        "path": "docs/decisions/decision-register.json",
        "decisionRef": "TRAMA-ADR-007",
        "decisionStatus": "APPROVED"
      },
      "observedAt": "2026-09-21T00:00:00Z",
      "freshness": {
        "policy": "UNTIL_CHANGE"
      },
      "confidence": "HIGH",
      "supports": [
        {
          "level": 2
        }
      ]
    },
    {
      "id": "EV-MAT-ATLAS-PR32-HEAD",
      "type": "PR_EXACT_HEAD",
      "area": "atlas",
      "subject": "Atlas R3-F0 exit exact head",
      "status": "PASS",
      "source": {
        "ref": "github:Curriculum-Atlas/pull/32",
        "path": "docs/evidence/trama-maturity-evidence-binding-2026-09-29.md",
        "repository": "antoniocorsano-boop/Curriculum-Atlas",
        "prNumber": 32,
        "mergeCommit": "423444be9dd883f4c35c6c1c89e94f6b0e5405fa"
      },
      "observedAt": "2026-09-25T04:19:33Z",
      "freshness": {
        "policy": "EVENT_BOUND"
      },
      "confidence": "HIGH",
      "supports": [
        {
          "level": 3
        }
      ],
      "binding": {
        "capabilityRef": "R3-F0",
        "releaseRef": "Curriculum-Atlas#32",
        "exactHead": "bc11577eeeeeed9c43ad62ac43fb7561e1197246",
        "eventRef": "EVT-R3-F0-S3V2-MERGE-32"
      }
    },
    {
      "id": "EV-MAT-ATLAS-PR32-CI",
      "type": "AUTOMATED_TEST",
      "area": "atlas",
      "subject": "Atlas R3-F0 F5 Exit exact-head workflow",
      "status": "PASS",
      "source": {
        "ref": "github-actions:Curriculum-Atlas/run/36093494130",
        "path": "docs/evidence/trama-maturity-evidence-binding-2026-09-29.md",
        "repository": "antoniocorsano-boop/Curriculum-Atlas",
        "prNumber": 32,
        "runId": "36093494130"
      },
      "observedAt": "2026-09-25T04:13:56Z",
      "freshness": {
        "policy": "EVENT_BOUND"
      },
      "confidence": "HIGH",
      "supports": [
        {
          "level": 4
        }
      ],
      "binding": {
        "capabilityRef": "R3-F0",
        "releaseRef": "Curriculum-Atlas#32",
        "exactHead": "bc11577eeeeeed9c43ad62ac43fb7561e1197246",
        "eventRef": "EVT-R3-F0-S3V2-MERGE-32"
      }
    },
    {
      "id": "EV-MAT-DOS-DOC",
      "type": "DOCUMENT_CANONICAL",
      "area": "docente-os",
      "subject": "Docente OS teacher-context authority in source registry",
      "status": "PASS",
      "source": {
        "ref": "source-registry:teacher-context",
        "path": "docs/knowledge/source-registry.json"
      },